{
  "$schema": "https://json-schema.org/draft/2020-12/schema",
  "type": "object",
  "required": ["id", "topicId", "prompt", "options", "correctOptionId", "explanation"],
  "properties": {
    "id": { "type": "string", "minLength": 1 },
    "topicId": { "type": "string", "minLength": 1 },
    "prompt": { "type": "string", "minLength": 1 },
    "options": { "type": "array", "minItems": 2, "items": { "type": "object", "required": ["id", "text"], "properties": { "id": { "type": "string" }, "text": { "type": "string" } } } },
    "correctOptionId": { "type": "string" },
    "explanation": { "type": "string" },
    "editorialRuleIds": { "type": "array", "items": { "type": "string" }, "uniqueItems": true },
    "temporalContext": { "type": "string", "enum": ["vigente-hasta-2027-05-24", "prospectivo-hasta-2027-05-24", "vigente-desde-2027-05-25"] },
    "source": { "type": "object", "required": ["lawId", "anchorId", "reference"], "properties": { "lawId": { "type": "string" }, "anchorId": { "type": "string" }, "reference": { "type": "string" }, "url": { "type": "string" } } },
    "origin": { "type": "object", "required": ["type", "label", "questionNumber"], "properties": { "type": { "type": "string" }, "label": { "type": "string" }, "resolution": { "type": "string" }, "questionNumber": { "type": "integer" }, "part": { "type": "string" }, "page": { "type": "integer" }, "historical": { "type": "boolean" }, "questionnaire": { "type": "string" }, "answerKey": { "type": "string" } } }
  }
}
