[
  {
    "id": "m3-2021-oficial-001",
    "topicId": "oficial-2021-comun",
    "prompt": "¿De qué trata el Título III de la Constitución española de 1978?",
    "options": [
      {
        "id": "a",
        "text": "De los derechos y deberes de los ciudadanos"
      },
      {
        "id": "b",
        "text": "De las Cortes Generales"
      },
      {
        "id": "c",
        "text": "De la Organización territorial del Estado"
      }
    ],
    "correctOptionId": "b",
    "explanation": "Respuesta oficial de la plantilla publicada: B. Esta pregunta procede del primer ejercicio oficial de 2021; el temario puede no coincidir con el vigente.",
    "origin": {
      "type": "official_exam",
      "label": "Convocatoria oficial M3 2021 · primer ejercicio",
      "resolution": "Resolución de 28 de julio de 2021, de la Secretaría de Estado de Función Pública (BOE núm. 182, de 31 de julio)",
      "questionNumber": 1,
      "part": "comun",
      "page": 2,
      "questionnaire": "data/official-exams/m3-2021/cuestionario-1er-ejercicio.pdf",
      "answerKey": "data/official-exams/m3-2021/plantilla-respuestas.pdf",
      "historical": true,
      "syllabusWarning": "Pregunta oficial de una convocatoria anterior; se conserva como material de práctica y comparación."
    }
  },
  {
    "id": "m3-2021-oficial-002",
    "topicId": "oficial-2021-comun",
    "prompt": "Una reforma de la Constitución que afecte a los derechos fundamentales recogidos en los artículos 15 a 29 ha de hacerse mediante el denominado:",
    "options": [
      {
        "id": "a",
        "text": "Procedimiento agravado de reforma"
      },
      {
        "id": "b",
        "text": "Real Decreto"
      },
      {
        "id": "c",
        "text": "Decreto legislativo"
      }
    ],
    "correctOptionId": "a",
    "explanation": "Respuesta oficial de la plantilla publicada: A. Esta pregunta procede del primer ejercicio oficial de 2021; el temario puede no coincidir con el vigente.",
    "origin": {
      "type": "official_exam",
      "label": "Convocatoria oficial M3 2021 · primer ejercicio",
      "resolution": "Resolución de 28 de julio de 2021, de la Secretaría de Estado de Función Pública (BOE núm. 182, de 31 de julio)",
      "questionNumber": 2,
      "part": "comun",
      "page": 2,
      "questionnaire": "data/official-exams/m3-2021/cuestionario-1er-ejercicio.pdf",
      "answerKey": "data/official-exams/m3-2021/plantilla-respuestas.pdf",
      "historical": true,
      "syllabusWarning": "Pregunta oficial de una convocatoria anterior; se conserva como material de práctica y comparación."
    }
  },
  {
    "id": "m3-2021-oficial-003",
    "topicId": "oficial-2021-comun",
    "prompt": "Según establece la Constitución, en su artículo 64.1, el nombramiento del Presidente del Gobierno corresponde al Rey, con el refrendo de:",
    "options": [
      {
        "id": "a",
        "text": "El presidente del Tribunal Constitucional"
      },
      {
        "id": "b",
        "text": "El presidente del Congreso de los Diputados"
      },
      {
        "id": "c",
        "text": "El ministro de Justicia en su calidad de notario mayor del Reino"
      }
    ],
    "correctOptionId": "b",
    "explanation": "Respuesta oficial de la plantilla publicada: B. Esta pregunta procede del primer ejercicio oficial de 2021; el temario puede no coincidir con el vigente.",
    "origin": {
      "type": "official_exam",
      "label": "Convocatoria oficial M3 2021 · primer ejercicio",
      "resolution": "Resolución de 28 de julio de 2021, de la Secretaría de Estado de Función Pública (BOE núm. 182, de 31 de julio)",
      "questionNumber": 3,
      "part": "comun",
      "page": 2,
      "questionnaire": "data/official-exams/m3-2021/cuestionario-1er-ejercicio.pdf",
      "answerKey": "data/official-exams/m3-2021/plantilla-respuestas.pdf",
      "historical": true,
      "syllabusWarning": "Pregunta oficial de una convocatoria anterior; se conserva como material de práctica y comparación."
    }
  },
  {
    "id": "m3-2021-oficial-004",
    "topicId": "oficial-2021-comun",
    "prompt": "Señale la respuesta CORRECTA sobre las Cortes Generales:",
    "options": [
      {
        "id": "a",
        "text": "Los miembros de las Cortes Generales están ligados por mandato imperativo."
      },
      {
        "id": "b",
        "text": "Las Cortes Generales representan al pueblo español."
      },
      {
        "id": "c",
        "text": "Ejercen la potestad reglamentaria del Estado."
      }
    ],
    "correctOptionId": "b",
    "explanation": "Respuesta oficial de la plantilla publicada: B. Esta pregunta procede del primer ejercicio oficial de 2021; el temario puede no coincidir con el vigente.",
    "origin": {
      "type": "official_exam",
      "label": "Convocatoria oficial M3 2021 · primer ejercicio",
      "resolution": "Resolución de 28 de julio de 2021, de la Secretaría de Estado de Función Pública (BOE núm. 182, de 31 de julio)",
      "questionNumber": 4,
      "part": "comun",
      "page": 2,
      "questionnaire": "data/official-exams/m3-2021/cuestionario-1er-ejercicio.pdf",
      "answerKey": "data/official-exams/m3-2021/plantilla-respuestas.pdf",
      "historical": true,
      "syllabusWarning": "Pregunta oficial de una convocatoria anterior; se conserva como material de práctica y comparación."
    }
  },
  {
    "id": "m3-2021-oficial-005",
    "topicId": "oficial-2021-comun",
    "prompt": "Al Consejo de Ministros, como órgano colegiado del Gobierno, le corresponde el ejercicio de las siguientes funciones:",
    "options": [
      {
        "id": "a",
        "text": "Velar por la correcta y fiel publicación de las disposiciones y normas emanadas del Gobierno que deban insertarse en el Boletín Oficial del Estado."
      },
      {
        "id": "b",
        "text": "Declarar los estados de alarma y de excepción y proponer al Congreso de los Diputados la declaración del estado de sitio."
      },
      {
        "id": "c",
        "text": "Resolver los conflictos de atribuciones que puedan surgir entre los diferentes Ministerios."
      }
    ],
    "correctOptionId": "b",
    "explanation": "Respuesta oficial de la plantilla publicada: B. Esta pregunta procede del primer ejercicio oficial de 2021; el temario puede no coincidir con el vigente.",
    "origin": {
      "type": "official_exam",
      "label": "Convocatoria oficial M3 2021 · primer ejercicio",
      "resolution": "Resolución de 28 de julio de 2021, de la Secretaría de Estado de Función Pública (BOE núm. 182, de 31 de julio)",
      "questionNumber": 5,
      "part": "comun",
      "page": 2,
      "questionnaire": "data/official-exams/m3-2021/cuestionario-1er-ejercicio.pdf",
      "answerKey": "data/official-exams/m3-2021/plantilla-respuestas.pdf",
      "historical": true,
      "syllabusWarning": "Pregunta oficial de una convocatoria anterior; se conserva como material de práctica y comparación."
    }
  },
  {
    "id": "m3-2021-oficial-006",
    "topicId": "oficial-2021-comun",
    "prompt": "El presidente del Gobierno en funciones no podrá ejercer las siguientes facultades:",
    "options": [
      {
        "id": "a",
        "text": "Proponer al Rey la convocatoria de un referéndum consultivo."
      },
      {
        "id": "b",
        "text": "Aprobar el Proyecto de Ley de Presupuestos Generales del Estado."
      },
      {
        "id": "c",
        "text": "Presentar proyectos de ley al Congreso de los Diputados o, en su caso, al Senado."
      }
    ],
    "correctOptionId": "a",
    "explanation": "Respuesta oficial de la plantilla publicada: A. Esta pregunta procede del primer ejercicio oficial de 2021; el temario puede no coincidir con el vigente.",
    "origin": {
      "type": "official_exam",
      "label": "Convocatoria oficial M3 2021 · primer ejercicio",
      "resolution": "Resolución de 28 de julio de 2021, de la Secretaría de Estado de Función Pública (BOE núm. 182, de 31 de julio)",
      "questionNumber": 6,
      "part": "comun",
      "page": 2,
      "questionnaire": "data/official-exams/m3-2021/cuestionario-1er-ejercicio.pdf",
      "answerKey": "data/official-exams/m3-2021/plantilla-respuestas.pdf",
      "historical": true,
      "syllabusWarning": "Pregunta oficial de una convocatoria anterior; se conserva como material de práctica y comparación."
    }
  },
  {
    "id": "m3-2021-oficial-007",
    "topicId": "oficial-2021-comun",
    "prompt": "El Plan Anual Normativo estará coordinado por el Ministerio de la Presidencia, Relaciones con las Cortes y Memoria Democrática, el cual elevará dicho Plan al Consejo de Ministros para su aprobación antes del:",
    "options": [
      {
        "id": "a",
        "text": "31 de diciembre."
      },
      {
        "id": "b",
        "text": "31 de mayo."
      },
      {
        "id": "c",
        "text": "30 abril."
      }
    ],
    "correctOptionId": "c",
    "explanation": "Respuesta oficial de la plantilla publicada: C. Esta pregunta procede del primer ejercicio oficial de 2021; el temario puede no coincidir con el vigente.",
    "origin": {
      "type": "official_exam",
      "label": "Convocatoria oficial M3 2021 · primer ejercicio",
      "resolution": "Resolución de 28 de julio de 2021, de la Secretaría de Estado de Función Pública (BOE núm. 182, de 31 de julio)",
      "questionNumber": 7,
      "part": "comun",
      "page": 2,
      "questionnaire": "data/official-exams/m3-2021/cuestionario-1er-ejercicio.pdf",
      "answerKey": "data/official-exams/m3-2021/plantilla-respuestas.pdf",
      "historical": true,
      "syllabusWarning": "Pregunta oficial de una convocatoria anterior; se conserva como material de práctica y comparación."
    }
  },
  {
    "id": "m3-2021-oficial-008",
    "topicId": "oficial-2021-comun",
    "prompt": "De los conflictos de competencia entre el Estado y las Comunidades Autónomas o de los de éstas entre sí, es competente para conocer:",